<?xml version="1.0" encoding="UTF-8"?>

<!DOCTYPE clientes SYSTEM "file:/C:/Users/Campus%20FP/Desktop/Hitolenguajedemarcas/pedidos.dtd">
<clientes>
    <año valor="2021">
        <trimestre valor="Q1">
            <!-- Ejemplo de pedidos para el primer trimestre de 2021 -->
            <pedido>
                <clienteId>1</clienteId>
                <numeroPedido>1001</numeroPedido>
                <fechaCompra>2021-01-15</fechaCompra>
                <fechaEntrega>2021-01-25</fechaEntrega>
                <totalFactura>450</totalFactura>
                <productos>
                    <producto>
                        <nombre>Cámara Digital</nombre>
                        <referencia>CD2021</referencia>
                        <precio>450</precio>
                        <unidades>1</unidades>
                    </producto>
                </productos>
            </pedido>
            <pedido>
                <clienteId>3</clienteId>
                <numeroPedido>1001</numeroPedido>
                <fechaCompra>2021-11-04</fechaCompra>
                <fechaEntrega>2021-11-05</fechaEntrega>
                <productos>
                    <producto>
                        <nombre>Teclado Mecánico</nombre>
                        <referencia>TM2021</referencia>
                        <precio>100</precio>
                    </producto>
                    <producto>
                        <nombre>Ratón Inalámbrico</nombre>
                        <referencia>RI2021</referencia>
                        <precio>50</precio>
                    </producto>
                    <producto>
                        <nombre>Memoria USB 64GB</nombre>
                        <referencia>MU64GB2021</referencia>
                        <precio>25</precio>
                    </producto>
                </productos>
                <totalFactura>175</totalFactura>
            </pedido>
            <pedido>
          <clienteId>7</clienteId>
          <numeroPedido>1002</numeroPedido>
          <fechaCompra>2021-12-04</fechaCompra>
          <fechaEntrega>2021-12-13</fechaEntrega>
          <productos>
              <producto>
                  <nombre>Cargador Portátil</nombre>
                  <referencia>CP2021</referencia>
                  <precio>30</precio>
              </producto>
          </productos>
          <totalFactura>30</totalFactura>
      </pedido>
      <pedido>
          <clienteId>9</clienteId>
          <numeroPedido>1003</numeroPedido>
          <fechaCompra>2021-01-01</fechaCompra>
          <fechaEntrega>2021-01-03</fechaEntrega>
          <productos>
              <producto>
                  <nombre>Ratón Inalámbrico</nombre>
                  <referencia>RI2021</referencia>
                  <precio>50</precio>
              </producto>
          </productos>
          <totalFactura>50</totalFactura>
      </pedido>
      <pedido>
          <clienteId>7</clienteId>
          <numeroPedido>1004</numeroPedido>
          <fechaCompra>2021-10-01</fechaCompra>
          <fechaEntrega>2021-10-10</fechaEntrega>
          <productos>
              <producto>
                  <nombre>Memoria USB 64GB</nombre>
                  <referencia>MU64GB2021</referencia>
                  <precio>25</precio>
              </producto>
          </productos>
          <totalFactura>25</totalFactura>
      </pedido>
      <pedido>
          <clienteId>12</clienteId>
          <numeroPedido>1005</numeroPedido>
          <fechaCompra>2021-04-15</fechaCompra>
          <fechaEntrega>2021-04-25</fechaEntrega>
          <productos>
              <producto>
                  <nombre>Laptop Profesional</nombre>
                  <referencia>LP2021</referencia>
                  <precio>1200</precio>
              </producto>
              <producto>
                  <nombre>Monitor 4K</nombre>
                  <referencia>M4K2021</referencia>
                  <precio>400</precio>
              </producto>
          </productos>
          <totalFactura>1600</totalFactura>
      </pedido>
      <pedido>
    <clienteId>2</clienteId>
    <numeroPedido>1002</numeroPedido>
    <fechaCompra>2021-02-20</fechaCompra>
    <fechaEntrega>2021-03-05</fechaEntrega>
    <totalFactura>720</totalFactura>
    <productos>
        <producto>
            <nombre>Teléfono móvil</nombre>
            <referencia>TM2021</referencia>
            <precio>720</precio>
            <unidades>1</unidades>
        </producto>
    </productos>
</pedido>
<pedido>
    <clienteId>3</clienteId>
    <numeroPedido>1003</numeroPedido>
    <fechaCompra>2021-03-10</fechaCompra>
    <fechaEntrega>2021-03-20</fechaEntrega>
    <totalFactura>850</totalFactura>
    <productos>
        <producto>
            <nombre>Portátil</nombre>
            <referencia>PL2021</referencia>
            <precio>850</precio>
            <unidades>1</unidades>
        </producto>
    </productos>
</pedido>
<pedido>
    <clienteId>4</clienteId>
    <numeroPedido>1004</numeroPedido>
    <fechaCompra>2021-04-05</fechaCompra>
    <fechaEntrega>2021-04-15</fechaEntrega>
    <totalFactura>300</totalFactura>
    <productos>
        <producto>
            <nombre>Auriculares Bluetooth</nombre>
            <referencia>AB2021</referencia>
            <precio>300</precio>
            <unidades>1</unidades>
        </producto>
    </productos>
</pedido>
<pedido>
    <clienteId>5</clienteId>
    <numeroPedido>1005</numeroPedido>
    <fechaCompra>2021-05-12</fechaCompra>
    <fechaEntrega>2021-05-22</fechaEntrega>
    <totalFactura>1500</totalFactura>
    <productos>
        <producto>
            <nombre>Televisor LED</nombre>
            <referencia>TL2021</referencia>
            <precio>1500</precio>
            <unidades>1</unidades>
        </producto>
    </productos>
</pedido>
<pedido>
    <clienteId>6</clienteId>
    <numeroPedido>1006</numeroPedido>
    <fechaCompra>2021-06-18</fechaCompra>
    <fechaEntrega>2021-06-28</fechaEntrega>
    <totalFactura>200</totalFactura>
    <productos>
        <producto>
            <nombre>Altavoz Bluetooth</nombre>
            <referencia>AB2021</referencia>
            <precio>200</precio>
            <unidades>1</unidades>
        </producto>
    </productos>
</pedido>
<pedido>
    <clienteId>7</clienteId>
    <numeroPedido>1007</numeroPedido>
    <fechaCompra>2021-07-03</fechaCompra>
    <fechaEntrega>2021-07-13</fechaEntrega>
    <totalFactura>700</totalFactura>
    <productos>
        <producto>
            <nombre>Smartwatch</nombre>
            <referencia>SW2021</referencia>
            <precio>700</precio>
            <unidades>1</unidades>
        </producto>
    </productos>
</pedido>
<pedido>
    <clienteId>8</clienteId>
    <numeroPedido>1008</numeroPedido>
    <fechaCompra>2021-08-20</fechaCompra>
    <fechaEntrega>2021-08-30</fechaEntrega>
    <totalFactura>400</totalFactura>
    <productos>
        <producto>
            <nombre>Impresora</nombre>
            <referencia>IP2021</referencia>
            <precio>400</precio>
            <unidades>1</unidades>
        </producto>
    </productos>
</pedido>
<pedido>
    <clienteId>9</clienteId>
    <numeroPedido>1009</numeroPedido>
    <fechaCompra>2021-09-05</fechaCompra>
    <fechaEntrega>2021-09-15</fechaEntrega>
    <totalFactura>3000</totalFactura>
    <productos>
        <producto>
            <nombre>Ordenador de sobremesa</nombre>
            <referencia>OS2021</referencia>
            <precio>3000</precio>
            <unidades>1</unidades>
        </producto>
    </productos>
</pedido>
<pedido>
    <clienteId>10</clienteId>
    <numeroPedido>1010</numeroPedido>
    <fechaCompra>2021-10-10</fechaCompra>
    <fechaEntrega>2021-10-20</fechaEntrega>
    <totalFactura>250</totalFactura>
    <productos>
        <producto>
            <nombre>Memoria USB</nombre>
            <referencia>MU2021</referencia>
            <precio>250</precio>
            <unidades>1</unidades>
        </producto>
    </productos>
</pedido>
<pedido>
    <clienteId>11</clienteId>
    <numeroPedido>1011</numeroPedido>
    <fechaCompra>2021-11-25</fechaCompra>
    <fechaEntrega>2021-12-05</fechaEntrega>
    <totalFactura>1200</totalFactura>
    <productos>
        <producto>
            <nombre>Tableta gráfica</nombre>
            <referencia>TG2021</referencia>
            <precio>1200</precio>
            <unidades>1</unidades>
        </producto>
    </productos>
</pedido>
<pedido>
    <clienteId>12</clienteId>
    <numeroPedido>1012</numeroPedido>
    <fechaCompra>2022-01-10</fechaCompra>
    <fechaEntrega>2022-01-20</fechaEntrega>
    <totalFactura>600</totalFactura>
    <productos>
        <producto>
            <nombre>Monitor</nombre>
            <referencia>MON2022</referencia>
            <precio>600</precio>
            <unidades>1</unidades>
        </producto>
    </productos>
</pedido>

<pedido>
    <clienteId>13</clienteId>
    <numeroPedido>1013</numeroPedido>
    <fechaCompra>2022-02-05</fechaCompra>
    <fechaEntrega>2022-02-15</fechaEntrega>
    <totalFactura>350</totalFactura>
    <productos>
        <producto>
            <nombre>Ratón inalámbrico</nombre>
            <referencia>RI2022</referencia>
            <precio>350</precio>
            <unidades>1</unidades>
        </producto>
    </productos>
</pedido>

<pedido>
    <clienteId>14</clienteId>
    <numeroPedido>1014</numeroPedido>
    <fechaCompra>2022-03-12</fechaCompra>
    <fechaEntrega>2022-03-22</fechaEntrega>
    <totalFactura>850</totalFactura>
    <productos>
        <producto>
            <nombre>Impresora multifunción</nombre>
            <referencia>IM2022</referencia>
            <precio>850</precio>